Anas,Bataw,Partner,Zacua Ventures,Zacua Ventures,anas@zacuaventures.com,Verified,Apollo,Apollo,"",Not Catch-all,2026-05-13T07:07:29+00:00,Partner,"","",contact@enlaye.com,"","","","","",false,Cold,Paris BuiltWorlds Summit,"",contact@enlaye.com,14,investment management,"construction project lifecycle, construction contract risk analysis, construction industry innovation, saas-enabled marketplace, ai in construction, building retrofit technology, digital transformation, construction innovation, real estate development platform, construction data platforms, built environment, construction project insights, construction procurement, construction marketplaces, urban infrastructure, industrial prefabrication, building materials innovation, consulting, construction industry growth, construction project scheduling, construction risk management, construction industry reports, edge data centers, digital infrastructure, modular data centers, industrial prefabrication for retrofitting, construction lifecycle software, ai-assisted software, construction lifecycle management, environmental impact, construction supply chain digitization, contech investor survey, digital infrastructure deployment, real estate, digital construction, sustainable construction, construction automation, construction ecosystem, co2 mineralization in concrete, construction project solutions, construction project management, construction industry trends, services, prefabrication technology, early-stage vc, carbon neutral buildings, technology, construction project financing, real estate technology, construction contracts ai, urbanization solutions, robotics for construction, building retrofit systems, construction saas, modular renovation, construction digital transformation, construction project automation, no-code ai for construction, construction technology, b2b, engineering services, site feasibility ai, construction tech startups, construction risk analysis, construction project early qualification, urban development, ai-driven real estate development, high-performance data centers, construction supply chain, construction, decarbonizing building materials, sustainable building, data intelligence in construction, construction robotics, construction procurement platform, urban building decarbonization, construction industry impact, construction project scaling, sustainability, environmental product declarations, cement innovation, portfolio management, construction tech, venture capital, finance, manufacturing, distribution, urbanization, ai, saas, robotics, data analytics, modular construction, information technology & services, environmental services, renewables & environment, financial services, mechanical or industrial engineering, computer software",http://www.linkedin.com/in/dr-anas-bataw-3b885b57,https://zacuaventures.com,http://www.linkedin.com/company/zacua-ventures,"",https://twitter.com/ZacuaVentures,Dubai,Dubai,United Arab Emirates,"Burlingame Ave, Burlingame, California, United States, 94010",Burlingame,California,United States,'+1 510-542-6072,"Gmail, Google Apps, Google Cloud Hosting, WP Engine, Typeform, Slack, WordPress.org, Google Font API, Nginx, Mobile Friendly, reCAPTCHA, IoT, Procore, Gusto, Node.js, Remote, Circle, Android, AI","",56000000,Other,56000000,2024-02-01T00:00:00+00:00,"","","",false,false,false,false,"",8711,54133,6a203a55139fe700016adf65,68bae3546c01510015f4b26e,6a203a55139fe700016adf65,"","","","","","","","","","","","","","","","","","",""
Jerome,Dumarty,CEO & Cofounder,MEPbrain,MEPbrain,"",Unavailable,"","","","","",Founder,C-Suite,"Executive, Founder",contact@enlaye.com,"","","","","",false,Cold,Paris BuiltWorlds Summit,"","","","","",http://www.linkedin.com/in/jerome-dumarty,"","","","",Pully,Vaud,Switzerland,"","","","","","","","","","","","","","",false,false,false,false,"","","",6a203a55139fe700016adf71,"",6a203a55139fe700016adf71,"","","","","","","","","","","","","","","","","","",""
Kara,Dinolfo,Conference and Event Programming Analyst,BuiltWorlds,BuiltWorlds,karadinolfo@builtworlds.com,Verified,Apollo,Apollo,"",Not Catch-all,2026-05-06T19:35:39+00:00,Entry,Marketing,"Event Marketing, Field Marketing",contact@enlaye.com,"","","",'+1 847-337-3777,"",false,Interested,"AI/ML BuiltWorlds 2026, Paris BuiltWorlds Summit",2026-05-18T21:05:54+00:00,"",21,information technology & services,"urban planning, real estate, construction, technology, engineering, startups, design, bim, leed, architecture, research, venture, investments, construction management, multimedia, innovation engineering, smart built environment, offsite construction supply chain, building lifecycle digital twin, consulting, digital twin platforms, construction project management tools, construction technology, benchmarking program, building lifecycle solutions, construction innovation, construction supply chain solutions, construction collaboration, building lifecycle management, construction supply chain innovation, building systems, offsite modular construction, construction project data integration, digital twins, construction digital transformation, construction industry digital transformation, construction technology adoption, construction digital tools, construction industry analysis, construction robotics startups, construction technology trends, construction technology research, modular construction supply chain, building design, project management software, building design innovation, project management, construction research reports, ai-driven project management, construction industry community, construction industry collaboration, construction robotics automation, building innovation, sustainable building materials, construction supply chain management, construction technology adoption strategies, construction ecosystem, digital transformation, technology benchmarking, ai in construction project planning, ai-powered construction site monitoring, digital twin for infrastructure, building performance analytics, prefab construction digital tools, construction technology accelerators, building materials innovation, digital construction supply chain, offsite construction, smart buildings, construction technology events, construction industry benchmarking, sustainable infrastructure materials, government, innovation, construction market insights, ai/ml in construction, construction data visualization, construction industry network, b2b, construction & real estate, construction data management, prefabrication technology, infrastructure industry, industry conferences, construction industry insights, construction site iot solutions, construction startups funding, construction market analysis, building materials supply chain, construction industry networking, construction technology benchmarking, construction trends, construction site safety automation, building lifecycle management software, construction supply chain management software, construction events, building materials, construction robotics, smart building systems, construction site automation, construction innovation awards, sustainable construction, construction project oversight tools, infrastructure, venture capital, offsite construction digital platform, construction data analytics, services, construction supply chain, construction project digital twin, construction project oversight, supply chain management, building systems integration, industry research, construction data analytics tools, construction startups, engineering services, digital construction tools, sustainability, ai in construction, machine learning solutions, venture capital in construction, infrastructure innovation, preconstruction services, smart jobsites, building management systems, modular building, construction efficiency, networking events, industry collaboration, investment in construction, data-driven research, construction analytics, building materials technology, contractor resources, field solutions, construction productivity, innovative building techniques, financial technology in construction, workforce development, construction industry trends, engineering solutions, urban infrastructure, real estate technology, peer networking, industry events, research forums, risk management in construction, stakeholder engagement, real-time construction data, project oversight, building product innovation, leadership conferences, startup investment, productivity, logistics & supply chain, information technology & services, environmental services, renewables & environment",http://www.linkedin.com/in/kara-dinolfo-51b751261,https://builtworlds.com,http://www.linkedin.com/company/builtworlds,https://www.facebook.com/BuiltWorlds,http://twitter.com/builtworlds,Chicago,Illinois,United States,"515 N State St, Chicago, Illinois, United States, 60654-2700",Chicago,Illinois,United States,'+1 847-337-3777,"Route 53, MailJet, Gmail, Google Apps, Mixpanel, Backbone JS Library, WP Engine, React, GitHub Hosting, Hubspot, Slack, Procore, IoT, Remote, AI",2022000,"","","","","","","",false,false,false,false,"",6799,"54133, 561920, 541910",6982a4a210658900019f87d9,698a365bf8f07a0001fce32c,6982a4a210658900019f87d9,"","","","","","","","","","","","","","","","","","",""
Jess,Ortz,Head,Cemex Ventures,Cemex Ventures,"",Unavailable,"","","","","",Head,"","",contact@enlaye.com,"","","","","",false,Cold,Paris BuiltWorlds Summit,"","","","","","","","","","","","","","","","","","","","","","","","","","","",false,false,false,false,"","","",6a203a55139fe700016adf8a,"",6a203a55139fe700016adf8a,"","","","","","","","","","","","","","","","","","",""
Subham,Kedia,"Investor, Hilti Venture",Hilti North America,Hilti North America,subham.kedia@hilti.com,Verified,Apollo,Apollo,"","",2026-06-03T14:30:29+00:00,Entry,"","",contact@enlaye.com,"","","",'+423 234 21 11,"",false,Interested,"AI/ML BuiltWorlds 2026, Paris BuiltWorlds Summit",2026-05-22T18:13:38+00:00,contact@enlaye.com,3300,construction,"tools, engineering, construction, software, sales, services, information technology & services",http://www.linkedin.com/in/subhamkedia27,https://hilti.com,http://www.linkedin.com/company/hilti-usa,https://www.facebook.com/HiltiNorthAmerica,"",San Francisco,California,United States,"7250 Dallas Parkway, Plano, Texas, United States, 75024",Plano,Texas,United States,'+423 234 21 11,"Akamai, Akamai DNS, Outlook, Drupal, Jira, Atlassian Confluence, Atlassian Cloud, Amazon SES, UPS, React Redux, Atlassian Bitbucket, GitLab, ServiceNow, Salesforce, Genesys Cloud CX Platform, Datadog, Zendesk, Google Dynamic Remarketing, Google Play, Cedexis Radar, Mobile Friendly, Facebook Widget, Hotjar, Linkedin Marketing Solutions, Google Maps, Kaltura, Facebook Custom Audiences, Google Analytics Ecommerce Tracking, Facebook Login (Connect), DoubleClick Conversion, Vimeo, Google Places, Google Analytics, Bing Ads, DoubleClick Floodlight, Ruby On Rails, DoubleClick, Adobe Media Optimizer, Google Font API, SOASTA, Google Tag Manager, YouTube, Remote","","","","","","","","",false,false,false,false,"","","",6940422346dec30001251626,6871183767759b000cf80e7b,6940422346dec30001251626,"","","","","","","","","","","","","","","","","","",""
Juan,Nieto,Founding & General Partner,Zacua Ventures,Zacua Ventures,juan@zacuaventures.com,Verified,Apollo,Apollo,"",Not Catch-all,2026-06-03T14:30:29+00:00,Partner,C-Suite,Founder,contact@enlaye.com,"","","","","",false,Interested,Paris BuiltWorlds Summit,2025-09-30T16:30:00+00:00,contact@enlaye.com,14,investment management,"construction project lifecycle, construction contract risk analysis, construction industry innovation, saas-enabled marketplace, ai in construction, building retrofit technology, digital transformation, construction innovation, real estate development platform, construction data platforms, built environment, construction project insights, construction procurement, construction marketplaces, urban infrastructure, industrial prefabrication, building materials innovation, consulting, construction industry growth, construction project scheduling, construction risk management, construction industry reports, edge data centers, digital infrastructure, modular data centers, industrial prefabrication for retrofitting, construction lifecycle software, ai-assisted software, construction lifecycle management, environmental impact, construction supply chain digitization, contech investor survey, digital infrastructure deployment, real estate, digital construction, sustainable construction, construction automation, construction ecosystem, co2 mineralization in concrete, construction project solutions, construction project management, construction industry trends, services, prefabrication technology, early-stage vc, carbon neutral buildings, technology, construction project financing, real estate technology, construction contracts ai, urbanization solutions, robotics for construction, building retrofit systems, construction saas, modular renovation, construction digital transformation, construction project automation, no-code ai for construction, construction technology, b2b, engineering services, site feasibility ai, construction tech startups, construction risk analysis, construction project early qualification, urban development, ai-driven real estate development, high-performance data centers, construction supply chain, construction, decarbonizing building materials, sustainable building, data intelligence in construction, construction robotics, construction procurement platform, urban building decarbonization, construction industry impact, construction project scaling, sustainability, environmental product declarations, cement innovation, portfolio management, construction tech, venture capital, finance, manufacturing, distribution, urbanization, ai, saas, robotics, data analytics, modular construction, information technology & services, environmental services, renewables & environment, financial services, mechanical or industrial engineering, computer software",http://www.linkedin.com/in/juannietovillamandos,https://zacuaventures.com,http://www.linkedin.com/company/zacua-ventures,"",https://twitter.com/ZacuaVentures,"","",Spain,"Burlingame Ave, Burlingame, California, United States, 94010",Burlingame,California,United States,'+1 510-542-6072,"Gmail, Google Apps, Google Cloud Hosting, WP Engine, Typeform, Slack, WordPress.org, Google Font API, Nginx, Mobile Friendly, reCAPTCHA, IoT, Procore, Gusto, Node.js, Remote, Circle, Android, AI","",56000000,Other,56000000,2024-02-01T00:00:00+00:00,"","","",false,false,false,false,"",8711,54133,69405efd8beed600019fd172,68bae3546c01510015f4b26e,69405efd8beed600019fd172,juan@zacuaventures.com,Mailbox Sync,User Managed,Mailbox Sync,"","","","","","","","","","","","","","",""
Sean,Wrenn,Director of Programming,BuiltWorlds,BuiltWorlds,sean.wrenn@builtworlds.com,Verified,Apollo,Apollo,"",Not Catch-all,2026-05-12T21:25:24+00:00,Director,Engineering & Technical,Software Development,contact@enlaye.com,"","","",'+1 847-337-3777,"",false,Interested,"AI/ML BuiltWorlds 2026, Paris BuiltWorlds Summit",2026-04-03T20:13:38+00:00,"",21,information technology & services,"urban planning, real estate, construction, technology, engineering, startups, design, bim, leed, architecture, research, venture, investments, construction management, multimedia, innovation engineering, smart built environment, offsite construction supply chain, building lifecycle digital twin, consulting, digital twin platforms, construction project management tools, construction technology, benchmarking program, building lifecycle solutions, construction innovation, construction supply chain solutions, construction collaboration, building lifecycle management, construction supply chain innovation, building systems, offsite modular construction, construction project data integration, digital twins, construction digital transformation, construction industry digital transformation, construction technology adoption, construction digital tools, construction industry analysis, construction robotics startups, construction technology trends, construction technology research, modular construction supply chain, building design, project management software, building design innovation, project management, construction research reports, ai-driven project management, construction industry community, construction industry collaboration, construction robotics automation, building innovation, sustainable building materials, construction supply chain management, construction technology adoption strategies, construction ecosystem, digital transformation, technology benchmarking, ai in construction project planning, ai-powered construction site monitoring, digital twin for infrastructure, building performance analytics, prefab construction digital tools, construction technology accelerators, building materials innovation, digital construction supply chain, offsite construction, smart buildings, construction technology events, construction industry benchmarking, sustainable infrastructure materials, government, innovation, construction market insights, ai/ml in construction, construction data visualization, construction industry network, b2b, construction & real estate, construction data management, prefabrication technology, infrastructure industry, industry conferences, construction industry insights, construction site iot solutions, construction startups funding, construction market analysis, building materials supply chain, construction industry networking, construction technology benchmarking, construction trends, construction site safety automation, building lifecycle management software, construction supply chain management software, construction events, building materials, construction robotics, smart building systems, construction site automation, construction innovation awards, sustainable construction, construction project oversight tools, infrastructure, venture capital, offsite construction digital platform, construction data analytics, services, construction supply chain, construction project digital twin, construction project oversight, supply chain management, building systems integration, industry research, construction data analytics tools, construction startups, engineering services, digital construction tools, sustainability, ai in construction, machine learning solutions, venture capital in construction, infrastructure innovation, preconstruction services, smart jobsites, building management systems, modular building, construction efficiency, networking events, industry collaboration, investment in construction, data-driven research, construction analytics, building materials technology, contractor resources, field solutions, construction productivity, innovative building techniques, financial technology in construction, workforce development, construction industry trends, engineering solutions, urban infrastructure, real estate technology, peer networking, industry events, research forums, risk management in construction, stakeholder engagement, real-time construction data, project oversight, building product innovation, leadership conferences, startup investment, productivity, logistics & supply chain, information technology & services, environmental services, renewables & environment",http://www.linkedin.com/in/sean-wrenn-66b690203,https://builtworlds.com,http://www.linkedin.com/company/builtworlds,https://www.facebook.com/BuiltWorlds,http://twitter.com/builtworlds,Chicago,Illinois,United States,"515 N State St, Chicago, Illinois, United States, 60654-2700",Chicago,Illinois,United States,'+1 847-337-3777,"Route 53, MailJet, Gmail, Google Apps, Mixpanel, Backbone JS Library, WP Engine, React, GitHub Hosting, Hubspot, Slack, Procore, IoT, Remote, AI",2022000,"","","","","","","",false,false,false,false,"",6799,"54133, 561920, 541910",694172d58019f300014d53de,698a365bf8f07a0001fce32c,694172d58019f300014d53de,"","","","","","","","","","","","","","","","","","",""
Henri,Lee,CEO & Founder,Xpanner,Xpanner,henri.lee@xpanner.com,Verified,Apollo,Apollo,"","",2026-06-07T07:51:41+00:00,Founder,C-Suite,"Executive, Founder",contact@enlaye.com,"","","","","",false,Cold,"2026 Chicago Global Summit, Paris BuiltWorlds Summit","","",53,construction,"bim, construction project management software, constructionequipment, service engineers, construction technology, tiltrotators, construction software, contech, construction automation, machine guidance, construction robotics, construction, construction equipment, construction data management, autonomous pile driving, jobsite automation, construction site iot, construction automation in civil projects, construction site management, sensor fusion, construction industry innovation, construction productivity enhancement, energy & utilities, construction safety automation, construction site data analytics, construction site ai, construction site analytics, jobsite safety systems, construction automation software, construction project efficiency, construction equipment integration, lidar, construction automation deployment, construction equipment automation, sensor technology, physical ai, jobsite productivity, construction automation hardware, sensor fusion technology, construction site digital twin, construction safety technology, construction site safety, construction automation pilot projects, task-specific automation, transportation & logistics, construction site digital management, construction site safety systems, construction automation in solar farms, automation as a service (aaas), b2b, labor reduction solutions, imu sensors, remote operation technology, construction project management, construction site remote operation, real-time jobsite data, construction site automation software, services, scalable retrofit automation kits, construction technology solutions, construction workflow automation, ai-powered construction automation, construction automation hardware integration, all other specialty trade contractors, construction automation platform, autonomous construction equipment, gnss, construction automation kit, construction project optimization, construction automation in renewable energy, construction automation demonstration, construction equipment retrofit, construction equipment control, digital construction workflows, machine control, real-time operational insight, remote control systems, cloud-powered software, scalable construction automation, physical ai retrofit kits, automation deployment, physical ai in construction, construction productivity tools, construction site data collection, construction site monitoring, construction site safety monitoring, construction robotics recognition, autonomous machinery control, construction site digitalization, construction data visualization, construction & real estate",http://www.linkedin.com/in/purplos,https://xpanner.com,http://www.linkedin.com/company/xpanner,"","",Santa Fe Springs,California,United States,"9825 Pioneer Blvd, Santa Fe Springs, California, United States, 90670-3217",Santa Fe Springs,California,United States,'+1 562-977-9083,"Route 53, Outlook, Webflow, Hubspot, Slack, Bootstrap Framework, Google Tag Manager, Vimeo, Linkedin Marketing Solutions, Facebook Custom Audiences, YouTube, Nginx, WordPress.org, Google Font API, Facebook Widget, Facebook Login (Connect), Mobile Friendly, Deel, Remote, Domo, Sisense, KNIME, AI, ARIS Simulation, OneTrust Tech Risk & Compliance, ConnectWise Control, BASE, Wider Planet, Tor, Electron, Retrofit, Quip, NetSuite","",40110000,Series B,22500000,2026-05-01T00:00:00+00:00,"","","",false,false,false,false,"",1799,23899,69caf0ff97f7840001606718,6a203a63139fe700016aeaee,69caf0ff97f7840001606718,"","","","","","","","","","","","","","","","","","",""
Ibrahim,Ashshohail,Chairman & CEO,Aqar,Aqar,ibrahim@aqar.fm,Verified,Apollo,Apollo,"",Catch-all,2026-05-13T10:54:52+00:00,C suite,C-Suite,Executive,contact@enlaye.com,"","","","","",false,Cold,Paris BuiltWorlds Summit,"","","","","",http://www.linkedin.com/in/ibrahimashshohail,"","","","",Riyadh,Riyadh Province,Saudi Arabia,"","","","","","","","","","","","","","",false,false,false,false,"","","",6a203a55139fe700016adf64,"",6a203a55139fe700016adf64,laheab@gmail.com,Apollo,Verified,Apollo,"","","","","","","","","","","","","","",""
Rodolphe,Hliot,CEO & Co-founder,Temelion,Temelion,"",Unavailable,"","","","","",Founder,C-Suite,"Executive, Founder",contact@enlaye.com,"","","","","",false,Cold,Paris BuiltWorlds Summit,"","","","","","","","","","","","","","","","","","","","","","","","","","","",false,false,false,false,"","","",6a203a55139fe700016adf7b,"",6a203a55139fe700016adf7b,"","","","","","","","","","","","","","","","","","",""
Chris,McMahon,n/a,Dassault Systemes,Dassault Systemes,chris.mcmahon@3ds.com,Verified,Apollo,Apollo,"",Catch-all,2026-06-03T14:30:29+00:00,Entry,"","",contact@enlaye.com,"","","","","",false,Cold,Paris BuiltWorlds Summit,"","","","","","","","","","","","","","","","","","","","","","","","","","","",false,false,false,false,"","","",6a203a55139fe700016adf89,"",6a203a55139fe700016adf89,"","","","","","","","","","","","","","","","","","",""
