First Name,Last Name,Title,Company Name,Company Name for Emails,Email,Email Status,Primary Email Source,Primary Email Verification Source,Email Confidence,Primary Email Catch-all Status,Primary Email Last Verified At,Seniority,Departments,Sub Departments,Contact Owner,Work Direct Phone,Home Phone,Mobile Phone,Corporate Phone,Other Phone,Do Not Call,Stage,Lists,Last Contacted,Account Owner,# Employees,Industry,Keywords,Person Linkedin Url,Website,Company Linkedin Url,Facebook Url,Twitter Url,City,State,Country,Company Address,Company City,Company State,Company Country,Company Phone,Technologies,Annual Revenue,Total Funding,Latest Funding,Latest Funding Amount,Last Raised At,Subsidiary of,Subsidiary of (Organization ID),Email Sent,Email Open,Email Bounced,Replied,Demoed,Number of Retail Locations,SIC Codes,NAICS Codes,Apollo Contact Id,Apollo Account Id,Apollo Record Id,Secondary Email,Secondary Email Source,Secondary Email Status,Secondary Email Verification Source,Tertiary Email,Tertiary Email Source,Tertiary Email Status,Tertiary Email Verification Source,Primary Intent Topic,Primary Intent Score,Secondary Intent Topic,Secondary Intent Score,Determine research guidelines 9706,Generate personalized email 6853,Generate an email subject line 5496,Construction Project #1,Qualify Contact,Final Analysis of Qualification 9359,Research target company 4339
Chao,Liu,n/a,EarthVisio,EarthVisio,"",Unavailable,"","","","","",Entry,"","",contact@enlaye.com,"","","","","",false,Cold,Paris BuiltWorlds Summit,"","","","","","","","","","","","","","","","","","","","","","","","","","","",false,false,false,false,"","","",6a203a55139fe700016adf83,"",6a203a55139fe700016adf83,"","","","","","","","","","","","","","","","","","",""
Dai,Ohama,"General Manager, Innovation & Incubation Office",Kajima,Kajima,ohama@kajima.com,Verified,Apollo,Apollo,"",Not Catch-all,2026-04-20T01:13:23+00:00,Manager,"Engineering & Technical, Operations","Emerging Technology / Innovation, Office Operations",contact@enlaye.com,"","","",'+1 201-518-2100,"",false,Interested,"AI/ML BuiltWorlds 2026, W7 2026 Outreach - AI/ML by BuiltWorlds, Paris BuiltWorlds Summit, Paris Global Summit - GCs Only",2026-02-23T20:13:16+00:00,contact@enlaye.com,1500,construction,"construction management, consulting, construction management consulting architecture, architecture, sustainable construction, asset management, innovation, architectural design, bridges, robotics, nuclear facilities, environmental impact mitigation, innovative construction materials, project management, sustainability, digital twin technology in construction, civil engineering, nuclear reactor construction, urban development, b2b, technology integration, engineering, real estate development, tokyo olympic infrastructure, hospitality, large infrastructure projects, digital construction, government, public sector clients, digital transformation, research and development, urban infrastructure, large-scale projects, dams, building construction, skyscraper engineering, smart building systems, industrial manufacturing, construction automation, environmental consulting, overseas projects, infrastructure, entertainment, water treatment, advanced materials, design services, environmental services, power plants, ai in construction, highway, street, and bridge construction, construction, facility management, heritage building restoration, power generation, private construction research, soil rehabilitation, high-rise buildings, services, construction & real estate, mechanical or industrial engineering, information technology & services, productivity, renewables & environment, leisure, travel & tourism, research & development, material science, highway, street, & bridge construction",http://www.linkedin.com/in/dai-ohama-17417886,https://kajima.com,http://www.linkedin.com/company/kajima,"","",Tokyo,Tokyo,Japan,"395 West Passaic Street, Rochelle Park, New Jersey, United States, 07662",Rochelle Park,New Jersey,United States,'+1 201-518-2100,"Amazon SES, Microsoft Office 365",19530000000,"","","","","","",true,false,false,false,true,"",1542,23731,6940326afea50100017f1332,68c88f724142590019161969,6940326afea50100017f1332,"","","","","","","","","","","","","","","","","","",""
Pascal,Laumet,n/a,Trimble,Trimble,pascal_laumet@trimble.com,Verified,Apollo,Apollo,"",Catch-all,2026-06-08T20:07:55+00:00,Entry,"","",contact@enlaye.com,"","","","","",false,Cold,Paris BuiltWorlds Summit,"","",13000,information technology & services,"construction & operation, utilities & government, transportation logistics, natural resources, software, positioning, geospatial, engineering, agriculture, mapping & gis, building design, survey engineering, optical & laser construction tools, survey amp engineering, civil & site construction & engineering, transportation amp logistics, technology, mep, enterprise software, construction, information technology, industrial machinery/components, industrials, software development, services, natural resources management, data platforms, asset management, transportation, geospatial mapping, data analytics, supply chain visibility, civil engineering, transportation technology, b2b, machine learning, iot integration, construction automation, engineering services, natural resources solutions, public sector solutions, predictive maintenance, automation, gps technology, transportation solutions, mapping and surveying, workflow automation, mapping and gis technology, geospatial data analysis, connected solutions, industry innovation, supply chain solutions, artificial intelligence, cloud-based solutions, iot solutions, construction management software, mapping and surveying instruments, cloud computing, location technology, civil engineering software, sustainability, cloud software, industry cloud services, construction site automation, public infrastructure, mapping drones and uavs, mapping and surveying tools, consulting, gps navigation, precision agriculture, construction software, mapping drones, real-time kinematic gps, construction management, fleet management, project management, mining, indoor mobile mapping, geospatial data platforms, mapping technology, geospatial analytics, surveying instruments, precision agriculture technology, workflow optimization, geospatial data, supply chain management, digital transformation, asset tracking iot, geospatial intelligence, civil engineering tools, operational efficiency, sustainable technology, gps systems, real-time positioning, asset tracking, government, construction project management, location positioning, inventory management, machine control, precision farming, innovation, data-driven insights, asset tracking solutions, gnss receivers, surveying hardware, real-time data, risk management, bim solutions, transport logistics optimization, natural resource mapping, precision positioning, ai integration, construction technology, geospatial solutions, transportation management, data-driven construction, automation solutions, real-time insights, efficiency improvements, sustainability technology, resource management, supply chain optimization, fleet management systems, emergency response technology, surveying solutions, building information modeling, 3d modeling, collaborative platforms, mobile workforce, vehicle tracking, safety compliance, project planning, advanced analytics, site management, procurement solutions, telemetry systems, logistics solutions, routing optimization, government technology solutions, transportation compliance, performance improvement, data interoperability, digital delivery, real-time communication, innovation strategies, community development, project lifecycle management, distribution, transportation & logistics, construction & real estate, information technology & services, enterprises, computer software, environmental services, renewables & environment, productivity, logistics & supply chain",http://www.linkedin.com/in/pascal-laumet-158699b,https://trimble.com,http://www.linkedin.com/company/trimble,https://facebook.com/TrimbleCorporate/,https://twitter.com/TrimbleCorpNews,St-Malo,Brittany,France,"10368 Westmoor Dr, Westminster, Colorado, United States, 80021-2796",Westminster,Colorado,United States,'+1 937-245-5500,"Route 53, Gmail, Google Apps, Amazon AWS, jQuery, UberFlip, Ruby On Rails, Google Frontend (Webserver), Google Play, Workday Recruit, HREF Lang, ShareThis, Cloudinary, RocketFuel, Google Maps (Non Paid Users), WordPress.org, Greenhouse.io, 6sense Revenue Marketing, Vimeo, Google Analytics, Nginx, Cloudflare Bot Management, Stripe, Next.js, 6sense, Gatsby, Mobile Friendly, Google Search Console, LeadForensics, iTunes, Viewport Meta, Facebook Custom Audiences, Google Maps, Linkedin Marketing Solutions, Google Forms, Hubspot, Vidyard, New Relic, YouTube, Pardot, Google Tag Manager, Mailshake, Facebook Widget, Bootstrap Framework, Visual Website Optimizer, DoubleClick, Varnish, Matomo, Google Font API, Typekit, Microsoft-IIS, Piwik, HubSpot Marketing Hub, 6sense Sales Intelligence, Wistia, Adobe Marketo Engage, Contentful, GoToWebinar, Facebook Login (Connect), Hotjar, ASP.NET, Marketo, reCAPTCHA, F5 BIG-IP, Remote, C#, Tekla, Construct, Microsoft Azure Monitor, Trimble Connect, Salesforce, Javascript, Jira, Laser Scanning, Panasonic Solution Technologies, Fusion ERP Analytics, AI, Transporeon, Olo, Git, .GIS, Amazon AWS, Google Cloud Platform, Microsoft Azure, Terraform, Docker, Kubernetes, GitLab, Jenkins, GitHub Actions, Prometheus, Grafana, Datadog, CANalyzer, CPI, .NET, Omnicell One, Rust, Laserfiche, SonicWall SRA, Notion, CUICK TRAC - DFARS and NIST 800-171 compliance solution, ISO+™, AWS SDK for JavaScript, Python, Amazon S3, Amazon EC2, Cityworks, Express, Esri, ArcGIS, Microsoft Office, SAP Crystal Reports, Copilot, Cursor, Spark, Delta Lake, Spring, Spring Boot, HTML Pro, CSS, TypeScript, Angular, GitHub, PostgreSQL, Apache Kafka, Maven, Salesforce Marketing Cloud, Salesforce Journey Builder, QMetry Automation Studio, Knak, Oracle Data Cloud, Eclipse Vert.x, Oracle Commerce Cloud, Oracle Commerce, Knockout.js, React, Node.js, Express JS Framework, Wider Planet, MercuryGate TMS, AWS Trusted Advisor, AWS Backup, Lambda Cloud, Atlassian Bitbucket, Docking & MDI for WPF, Microsoft SQL Server Reporting Services, Salesforce Lightning Web Components, Playwright, Vitess, MongoDB, Selenium, DotNetNuke, Appium, Testng, Saucelabs, Dell PowerEdge Servers, Microsoft Windows Server 2012, Android, Apple, Data Analytics, Langchain, ANGEL LMS, Azure Data Lake Storage, XGBoost, Salesforce Service Cloud, Snowflake, dbt, Micro, MySQL, SketchUp, ADAPT, Trimble, Kantata, Gainsight, Vista, Oracle Analytics Cloud, Convertkit, , SalesLoft, Tableau, Domo, PowerBI Tiles, MATLAB, Simulink, NetSuite SuiteBuilder, SAP, Google Cloud Tasks, Bidtellect, Dell EMC PowerStore, n8n, Microsoft.NET Core 3.1, Azure Service Bus, Unity, Gem, Trello, Loopio, Visual Studio, Selenium WebDriver, Pipedrive, Siemens SIMATIC S7, Splunk SOAR, Woo Commerce Memberships, McAfee Total Protection for Data Loss (DLP), Verizon WAF, Sift, Magnet AXIOM, IBM ILOG CPLEX Optimization Studio, Azure Linux Virtual Machines, IBM HTTP Server, ebs, 3M 360 Encompass - Health Analytics Suite, AWS Transfer for SFTP, Wordpress.com, Microsoft PowerShell, Bash, MITRE ATT&CK, Viewpoint, SWIFT, Xcode, Cisco BroadWorks, Salesforce CPQ, Salesforce CRM Analytics, Salesforce VisualForce, Ning, Apex, Soap Media, REST, Mode, Google Cloud Pub/Sub, Micro Focus AppPulse Web, Oracle Essbase, Google Classroom, HasOffers, Posit, Snyk Code (SAST), go+, Android Studio, Postman, Cisco Unified Intelligence Center, Arista Networks, SolarWinds, Wireshark, 24-7 Media, Cisco VPN, SS&C, Google Workspace, Airflow, Atlassian Confluence, Azure Purview, Alation, Metadata Hub, Tor, Spectrum, Google Cloud BigQuery, Databricks, SolidCAM, Asana, Smartsheet, UV layout, Ad Astra, Azure Devops, Bicep, Pulumi, Nevron Vision for SSRS, , AWS GovCloud, Amazon DynamoDB, Redshift, Gemini, SAP Financial Supply Chain Management (FSCM), Gong, LinkedIn Sales Navigator, ChatGPT, Google Ads, Meta Ads Manager, TikTok, Zoomdata, Zoom Phone, Zoom Contact Center, Docebo, GitHub Copilot, SAP Materials Management, AWS Glue, AWS Lambda, AWS Step Functions, AWS Batch, Amazon Elastic Container Service (Amazon ECS), Amazon QuickSight, Amazon SageMaker, Dagster, AWS CloudFormation, AWS CodeBuild, Redshift, Athena, PySpark, , Tekla Structural Designer, Microsoft Excel, VMware, CallMiner Eureka, Frame, Salesforce Marketing Cloud Intelligence (formerly Datorama), Analyzer, OpenTelemetry, Oracle E Business Suite, PL/SQL, Oracle Forms, Oracle Reports, Oracle XML DB, Oracle BI Publisher, LEAP, Oracle JDeveloper, Flow, Bombora Measurement, Microsoft Active Directory Federation Services, Google, ChurnZero, Totango, Autodesk BIM Collaborate, Rocketlane, Admin, Azure Digital Twins, Google AdSense for Domains, Workday, Stabicad, Google Optimize, Refinitiv World-Check Risk Intelligence, Optimizely, Sumologic, Splunk, Amazon CloudWatch, Wrike, AWS Cloud Development Kit (AWS CDK), ECS, InstallShield, TeamCity, AutoCAD, Revit, , Hibernate, JPA Health, Flyway, Red Hat AMQ, Apache Solr, GWT - Google Web Toolkit, Fred Optical Engineering Software, BASE, Act!, Oracle Advanced Pricing, Quantcast, ACL, Amazon FreeRTOS, Zuora Revenue (formerly RevPro), IBM Data Warehouse, Azure Data Lake Analytics, FederatedMedia, EMC, REACH, NetApp FAS Series Storage Systems, AT&T, SAP BusinessObjects Web Intelligence, Cognism, MySQL, Seismic, Google Drive, Trimble Accubid Classic, SAP Global Trade Services, PROS, Workday Prism Analytics, FANUC FIELD System, Gainsight PX, Amplitude, Salesforce Field Service, ZoomInfo, Microsoft System Center, Cognito, Sizmek (MediaMind), AWS Organizations, SAM, API Gateway, Amazon EventBridge, OpenID, Kiosked, Bevywise MQTT Broker, Snow, Miro, ConnectWise Control, EFI, C/C++, Agilent Technologies, Welligent, Part of ContinuumCloud, AWS Glue Data Catalog, Batch, Make, Athena, Corsearch Trademark and Brand Clearance, Infor Cloverleaf Integration Suite, Google Docs, Google Sheets, OpenAI Whisper, Anthropic Claude, Copado, CloudPay, Looker, IBM Cognos Analytics, C# (C Sharp), Capterra, DevExpress, ServiceNow IT Service Management (ITSM), ROOM, Azure Analysis Services, Excel4Apps, AWS Analytics, Jira Service Management, ServiceNow, Zendesk, Freshservice, Mulesoft, Oracle Cloud, LastPass, 1Password, Microsoft 365, Amazon Linux 2, Microsoft Windows Server 2000, Blazor, TrakSYS, HELM, Automic Automation, NTENT, Google Meet, Dell Avamar, VueJS, Godot Engine, Figma, Storybook, FlipHTML5, Amazon Managed Streaming for Apache Kafka (Amazon MSK), SonicWall Network Security appliance (NSa) Series, Oracle Financial Services, INAP, AMP, Articulate 360, Anthropic Claude, LangGraph, OpenAPI, Unity Catalog, Gravitee.io, Vscode, Azure Virtual Desktop, Power BI Documenter, FinancialForce, Certinia, ARIS Simulation, UK Fast Hosting, LinkedIn Ads, Slack, ArcGIS Pro, Azure Cloud Services, ArcGIS Field Maps, Agile GCP Labs, ADVA Optical, Acoustic Analytics, Dell EMC PowerScale, OpenAI, Zapier, Workato, Strato, FUSION, Autodesk, Bentley, PyTorch, Open Neural Network Exchange (ONNX), Aha!, UKG Pro Advanced Scheduling, Creo+, BILL, Entity Framework Core, B2W Estimate, Apache Spark, CAT, OrCAD PSpice Designer, Secured MVC Forum on Windows 2012 R2, Spiceworks IP Scanner, Impartner PRM, Bynder, IDC, mO Jira OAuth SSO, Jira OpenID Connect SSO, Jira OIDC SSO, Procore, IBM i, Altair Radioss, GraphQL, Google Analytics 4 (GA4), Google Apps Script for G Suite, Less, React/node.js Storefront, Redux, npm, Yarn, webpack, Jest, Karma, Pimcore, Wordpress, AWX, JFrog Artifactory, Debian, Proxmox VE, Redis, MariaDB, Monday.com, Visio, Interact, Adobe XD, Azure Cost Management, accessiBe, WebOffice, Canva, Adobe Creative Suite, Google Sites, Salesforce Revenue Cloud, GoDataFeed, Microsoft Sql Server, Azure Functions, Azure Storage Explorer, Sales Cloud Einstein, Salesforce Order Management, Amazon Managed Workflows for Apache Airflow (MWAA), Oracle Fusion Middleware, Workday Time Tracking, Google Cloud, Amazon SES, Salesforce Flow, Cisco TelePresence Management Suite (TMS), Atlan, Collibra, Google Ads Data Hub, Jira Software, Nagios, Alteryx, Tableau Prep, ServiceNow Configuration Management Database, Looker Studio, Yocto, Argon CI/CD Security, WebSpectator, Amazon Associates, PagerDuty, Amazon Product Advertising API, JWT, GRPC, Aurora",3587300000,"","","","","","","",false,false,false,false,"",1794,54133,6a203a55139fe700016adf82,698a365bf8f07a0001fce32a,6a203a55139fe700016adf82,"","","","","","","","","","","","","","","","","","",""
